{
  "authority": {
    "actor": "operator.sovereign",
    "mode": "reviewed"
  },
  "created_at": "2026-04-22T12:00:00-06:00",
  "decision_refs": [],
  "evidence_refs": [
    "receipt:example:001"
  ],
  "hold_reason": "governance appeal pending",
  "id": "experience.release_hold.example.001",
  "kind": "experience.release_hold",
  "lift_conditions": [
    "appeal_window_closed",
    "regression_rechecked"
  ],
  "notes": [
    "seed example for v0.8 polis governance"
  ],
  "schema_version": "v1",
  "status": "proposed",
  "subject_ref": "assistant_release:courier.1.4.0"
}
